{"arms":[{"admission_source_sha256":{"bench/stable_benchmark/__init__.py":"6be0e85aaa81bac66099aa6ca4c3c6b53375a6928a98703541f3e5aed2afe7c6","bench/stable_benchmark/admission.py":"ea820c8cbabb9a275c902dcb54061fcb56ec0f2116d1c4f91d513d678a8b140a","bench/stable_benchmark/fixtures.py":"e814fd805864055bfff10b1525af59dbae678f86dbc3bd4336f03ba877bd2d0f","bench/stable_benchmark/graders.py":"66068fb055b3d9cb0431e037bde29b4b6180dae3b0e74455e06071aba1ef961d","bench/stable_benchmark/manifest.py":"4566688c3de7193544f29cd0be55ec780bea0bd3e0defe080132c0da7ae34a57","bench/stable_benchmark/replay.py":"240e31f0d3b88e6b49c1f33b84d6d56ecb298a2fd1705276d1fdb0bf8c78f5ec","bench/stable_benchmark/runner.py":"81efee388d2fac34fef3da41dfa9fde5b8ed29836a462b444b90e9f174986c39","bench/weekly_upgrade_portfolio/code_sandbox.py":"db611859025f05344af0b6c1ce741d94bb3165355624a09995147189c6210983"},"arm_id":"resident-stack","execution_source_sha256":{"agent_wrapper/__init__.py":"e3b0c44298fc1c149afbf4c8996fb92427ae41e4649b934ca495991b7852b855","agent_wrapper/backends/__init__.py":"89c9f1354a945de9b176263f64b8b696112680e077b3cb57c8d2c22242a0d29a","agent_wrapper/backends/anthropic.py":"dda35f505c847202590e43cd7c66efc799d8646f58bae6ae2cc73dae493a655a","agent_wrapper/backends/base.py":"e2cda27db6e577c4952bdc62be33e93795424b0dbcec61a4a0acd1de8dd47055","agent_wrapper/backends/ollama_openai.py":"cde8196436f22b05f12bef0ccf491a54030ff13b83149c5542b67d3ac8584e67","agent_wrapper/backends/qwen_vllm.py":"a5dc9a4ea5071dfcbd263bd2247fe1a8e0ae8fe4f5e791a2b27b1e694eef9739","agent_wrapper/backends/vllm_openai.py":"b8c73d2351f807ef825c90f7fa761a2f1c8d32589e64836f0fe1e8b39b84eb8e","agent_wrapper/generation_policy.py":"3a45aa1303bb0f53fe73533b9750b07049acf3c0a0eaa4107582812f5db449a5","agent_wrapper/upgrade_lease.py":"3df940550f66c8b8f628b141a3b45c40ae4bd61c960b383e3be61969943dea07","agent_wrapper/worker_activity.py":"30fa1b422a16b705dc698fe908b68d74dae095105021d2183ac4514180521efc","agent_wrapper/wrapper.py":"5ee8746587c7ab4e3bc77e317c8d586c7371341ad7f610444b10d25136d4ed0c","bench/stable_benchmark/__init__.py":"6be0e85aaa81bac66099aa6ca4c3c6b53375a6928a98703541f3e5aed2afe7c6","bench/stable_benchmark/fixtures.py":"e814fd805864055bfff10b1525af59dbae678f86dbc3bd4336f03ba877bd2d0f","bench/stable_benchmark/graders.py":"66068fb055b3d9cb0431e037bde29b4b6180dae3b0e74455e06071aba1ef961d","bench/stable_benchmark/manifest.py":"4566688c3de7193544f29cd0be55ec780bea0bd3e0defe080132c0da7ae34a57","bench/stable_benchmark/runner.py":"81efee388d2fac34fef3da41dfa9fde5b8ed29836a462b444b90e9f174986c39","bench/weekly_upgrade_portfolio/code_sandbox.py":"db611859025f05344af0b6c1ce741d94bb3165355624a09995147189c6210983","schema/calls.jsonl.schema.json":"fca1c282e1c626c8b8403aaa5048c4d076b2db90eb7a2dbf04d4020e2739a77b"},"lifecycle":{"controller_source_sha256":{"agent_wrapper/__init__.py":"e3b0c44298fc1c149afbf4c8996fb92427ae41e4649b934ca495991b7852b855","agent_wrapper/backends/__init__.py":"89c9f1354a945de9b176263f64b8b696112680e077b3cb57c8d2c22242a0d29a","agent_wrapper/backends/anthropic.py":"dda35f505c847202590e43cd7c66efc799d8646f58bae6ae2cc73dae493a655a","agent_wrapper/backends/base.py":"e2cda27db6e577c4952bdc62be33e93795424b0dbcec61a4a0acd1de8dd47055","agent_wrapper/backends/ollama_openai.py":"cde8196436f22b05f12bef0ccf491a54030ff13b83149c5542b67d3ac8584e67","agent_wrapper/backends/qwen_vllm.py":"a5dc9a4ea5071dfcbd263bd2247fe1a8e0ae8fe4f5e791a2b27b1e694eef9739","agent_wrapper/backends/vllm_openai.py":"b8c73d2351f807ef825c90f7fa761a2f1c8d32589e64836f0fe1e8b39b84eb8e","agent_wrapper/generation_policy.py":"3a45aa1303bb0f53fe73533b9750b07049acf3c0a0eaa4107582812f5db449a5","agent_wrapper/upgrade_lease.py":"3df940550f66c8b8f628b141a3b45c40ae4bd61c960b383e3be61969943dea07","agent_wrapper/worker_activity.py":"30fa1b422a16b705dc698fe908b68d74dae095105021d2183ac4514180521efc","agent_wrapper/wrapper.py":"5ee8746587c7ab4e3bc77e317c8d586c7371341ad7f610444b10d25136d4ed0c","bench/flash_next_ab/adapters.py":"b74397b101ccfd89e02b1e6524d863b6d6d34faf6d38b5a5aa88fe52a6c8b1ce","bench/flash_next_ab/compare.py":"2501431b28a030731e602ed827323c66b26c0c231935de9a03bd0bc3cbdab036","bench/flash_next_ab/evaluation_window.py":"23086679f5d169560e4b77acedb3d05f36d4dec551155fb286e97a899270103a","bench/flash_next_ab/harness.py":"edd73eaa1cd09b9cef1e9961bf1e306ddf64b5076dcea904d0c37bca053ea9fb","bench/flash_next_ab/manifest.py":"e4b5a84bb5a4ff1733d41aae75273588d43063f3556df5270e7adec7c3580d39","bench/flash_next_ab/qualification.py":"d908326a3e7772765374d798d45feccc7e4ac82c64f78d6b7ec52c09c9b6a69a","bench/flash_next_ab/resident_evaluation_window.py":"bc5d7ecea51e562033d7aff308f5c9365e5184997603f29a86b92e2cc34bfd2c","bench/flash_next_ab/transport.py":"a4f55715ac4d14c4d2d1fd4a1ca99a12316629d7af55089d30de2e1ed2e6a6e4","bench/stable_benchmark/__init__.py":"6be0e85aaa81bac66099aa6ca4c3c6b53375a6928a98703541f3e5aed2afe7c6","bench/stable_benchmark/admission.py":"ea820c8cbabb9a275c902dcb54061fcb56ec0f2116d1c4f91d513d678a8b140a","bench/stable_benchmark/fixtures.py":"e814fd805864055bfff10b1525af59dbae678f86dbc3bd4336f03ba877bd2d0f","bench/stable_benchmark/graders.py":"66068fb055b3d9cb0431e037bde29b4b6180dae3b0e74455e06071aba1ef961d","bench/stable_benchmark/manifest.py":"4566688c3de7193544f29cd0be55ec780bea0bd3e0defe080132c0da7ae34a57","bench/stable_benchmark/replay.py":"240e31f0d3b88e6b49c1f33b84d6d56ecb298a2fd1705276d1fdb0bf8c78f5ec","bench/stable_benchmark/runner.py":"81efee388d2fac34fef3da41dfa9fde5b8ed29836a462b444b90e9f174986c39","bench/stable_benchmark/supervised_window.py":"fb044ca2e1249ba2e1c904518c3e5d97e558c7a7e4020d34b92e51c648f1cf9e","bench/weekly_upgrade_portfolio/code_sandbox.py":"db611859025f05344af0b6c1ce741d94bb3165355624a09995147189c6210983","orchestrator/weekly_upgrade.py":"f2ac2b818fb1bab14b18942ba71810b415da26d6bd70c38fc3d9d0bb51de2277","orchestrator/weekly_upgrade_budget.py":"02f03bcfda6de496e995c8aed71a27bbffbf85f19e8e529df0123a059f5ced2f","orchestrator/weekly_upgrade_trial.py":"cbab2a0469df70820c3b5edc89c7a6bf4e391c340fb6d7f44ecc43cbb3244b22","schema/calls.jsonl.schema.json":"fca1c282e1c626c8b8403aaa5048c4d076b2db90eb7a2dbf04d4020e2739a77b"},"receipt_directory":"/home/decross1/projects/a_bgt_rsi_v2_artifacts/2026-09-16/stable-benchmark/windows/stable-benchmark-v1-1-20260916-a.resident","window_id":"stable-benchmark-v1-1-20260916-a.resident","window_plan_sha256":"53284e7db209a0f45c79b1386ea7cde890fde40ad885221e11f0f83c48c87715","worker_argv_sha256":"8ce1eff95c2495520b7fd92326ee9404216d0edd028fe46c0213e5c112185ca6"},"manifest":{"path":"/home/decross1/projects/a_bgt_rsi_v2_artifacts/2026-09-16/ui-benchmark-eight-hour/stable-benchmark-v1_1/manifests/stable-benchmark-v1-1-20260916-a.resident-stack.json","sha256":"714c48fa990f1dacb83acc79061cb5a58843a51ba9cd57e567e45f6558da3537"},"replay_source_sha256":{"bench/stable_benchmark/__init__.py":"6be0e85aaa81bac66099aa6ca4c3c6b53375a6928a98703541f3e5aed2afe7c6","bench/stable_benchmark/fixtures.py":"e814fd805864055bfff10b1525af59dbae678f86dbc3bd4336f03ba877bd2d0f","bench/stable_benchmark/graders.py":"66068fb055b3d9cb0431e037bde29b4b6180dae3b0e74455e06071aba1ef961d","bench/stable_benchmark/manifest.py":"4566688c3de7193544f29cd0be55ec780bea0bd3e0defe080132c0da7ae34a57","bench/stable_benchmark/replay.py":"240e31f0d3b88e6b49c1f33b84d6d56ecb298a2fd1705276d1fdb0bf8c78f5ec","bench/stable_benchmark/runner.py":"81efee388d2fac34fef3da41dfa9fde5b8ed29836a462b444b90e9f174986c39","bench/weekly_upgrade_portfolio/code_sandbox.py":"db611859025f05344af0b6c1ce741d94bb3165355624a09995147189c6210983"},"role":"reference","run_receipt_directory":"/home/decross1/projects/a_bgt_rsi_v2_artifacts/2026-09-16/ui-benchmark-eight-hour/stable-benchmark-v1_1/runs/stable-benchmark-v1-1-20260916-a/resident-stack"},{"admission_source_sha256":{"bench/stable_benchmark/__init__.py":"6be0e85aaa81bac66099aa6ca4c3c6b53375a6928a98703541f3e5aed2afe7c6","bench/stable_benchmark/admission.py":"ea820c8cbabb9a275c902dcb54061fcb56ec0f2116d1c4f91d513d678a8b140a","bench/stable_benchmark/fixtures.py":"e814fd805864055bfff10b1525af59dbae678f86dbc3bd4336f03ba877bd2d0f","bench/stable_benchmark/graders.py":"66068fb055b3d9cb0431e037bde29b4b6180dae3b0e74455e06071aba1ef961d","bench/stable_benchmark/manifest.py":"4566688c3de7193544f29cd0be55ec780bea0bd3e0defe080132c0da7ae34a57","bench/stable_benchmark/replay.py":"240e31f0d3b88e6b49c1f33b84d6d56ecb298a2fd1705276d1fdb0bf8c78f5ec","bench/stable_benchmark/runner.py":"81efee388d2fac34fef3da41dfa9fde5b8ed29836a462b444b90e9f174986c39","bench/weekly_upgrade_portfolio/code_sandbox.py":"db611859025f05344af0b6c1ce741d94bb3165355624a09995147189c6210983"},"arm_id":"flash-unissued","execution_source_sha256":{"agent_wrapper/__init__.py":"e3b0c44298fc1c149afbf4c8996fb92427ae41e4649b934ca495991b7852b855","agent_wrapper/backends/__init__.py":"89c9f1354a945de9b176263f64b8b696112680e077b3cb57c8d2c22242a0d29a","agent_wrapper/backends/anthropic.py":"dda35f505c847202590e43cd7c66efc799d8646f58bae6ae2cc73dae493a655a","agent_wrapper/backends/base.py":"e2cda27db6e577c4952bdc62be33e93795424b0dbcec61a4a0acd1de8dd47055","agent_wrapper/backends/ollama_openai.py":"cde8196436f22b05f12bef0ccf491a54030ff13b83149c5542b67d3ac8584e67","agent_wrapper/backends/qwen_vllm.py":"a5dc9a4ea5071dfcbd263bd2247fe1a8e0ae8fe4f5e791a2b27b1e694eef9739","agent_wrapper/backends/vllm_openai.py":"b8c73d2351f807ef825c90f7fa761a2f1c8d32589e64836f0fe1e8b39b84eb8e","agent_wrapper/generation_policy.py":"3a45aa1303bb0f53fe73533b9750b07049acf3c0a0eaa4107582812f5db449a5","agent_wrapper/upgrade_lease.py":"3df940550f66c8b8f628b141a3b45c40ae4bd61c960b383e3be61969943dea07","agent_wrapper/worker_activity.py":"30fa1b422a16b705dc698fe908b68d74dae095105021d2183ac4514180521efc","agent_wrapper/wrapper.py":"5ee8746587c7ab4e3bc77e317c8d586c7371341ad7f610444b10d25136d4ed0c","bench/stable_benchmark/__init__.py":"6be0e85aaa81bac66099aa6ca4c3c6b53375a6928a98703541f3e5aed2afe7c6","bench/stable_benchmark/fixtures.py":"e814fd805864055bfff10b1525af59dbae678f86d